{
  "handoffVersion": "1.0.0",
  "agentId": "enemy-asset-curator",
  "status": "needs-review",
  "updatedAt": "2026-07-04T18:53:00Z",
  "summary": "Foundation level now has three primitive cube enemies wired to reusable health and weapon-ray damage; external enemy art is still pending.",
  "observations": [
    "The foundation level has three cube enemy placeholders.",
    "Each cube owns a shared Health instance and reports through the debug enemy snapshot.",
    "The spawn-lane cube is destroyable by normal hold-fire input in local browser smoke.",
    "No level-specific external enemy brief has been created."
  ],
  "decisions": [
    "Enemy assets must be judged by silhouette, animation coverage, hit proxies, audio hooks, and mobile performance.",
    "Use recurring enemy types for recognition and unique variants for level identity.",
    "Keep the cube enemy system as the first behavior contract until external enemy assets replace the placeholder meshes."
  ],
  "caughtIssues": [
    "Current cube enemies validate damage and destruction only; they do not block player movement or animate hit/death states."
  ],
  "risks": [
    "Enemy assets without readable attack and hit states will make mobile combat feel unfair.",
    "Replacing cubes with external assets can break ray-hit readability if hit proxies are not authored deliberately."
  ],
  "blockers": [],
  "artifacts": [],
  "jsonForAgents": {
    "currentPlaceholderEnemies": {
      "count": 3,
      "type": "primitive-cube",
      "behavior": [
        "health",
        "weapon-ray-damage",
        "destroy-on-zero-health",
        "debug-snapshot-reporting"
      ],
      "firstSmokeTargetId": "enemy.cube.vanguard"
    },
    "requiredAnimations": [
      "idle",
      "move",
      "attack",
      "hit",
      "death"
    ],
    "requiredProxyTypes": [
      "capsule",
      "box",
      "projectile-blocker"
    ]
  },
  "nextAgents": [
    "external-asset-scout",
    "license-provenance-curator",
    "asset-playground-qa-agent",
    "playthrough-qa-agent"
  ]
}
