{
  "handoffVersion": "1.0.0",
  "agentId": "level-kit-curator",
  "status": "in-progress",
  "updatedAt": "2026-07-04T05:20:00Z",
  "summary": "Foundation layout QA now rejects diagonal cuts, bounded narrow segments, and one-tile corner pinches; six reported pinch cells were closed.",
  "observations": [
    "The 45 x 45 foundation map remains a placeholder layout.",
    "validate-levels now checks bounded row/column segments below 3 tiles.",
    "validate-levels now checks diagonal solid-corner cuts that create one-tile squeeze paths.",
    "The detected diagonal squeeze at rows 29/30, columns 17/18 was widened by opening row 30 columns 16-17.",
    "User-reported world coordinates 12.1, -2.1 and 12.2, 7.6 now map to solid wall cells instead of open edge notches.",
    "validate-levels now checks cardinal-wall plus diagonal-corner pinch patterns.",
    "The current foundation map has 1640 walkable tiles and remains spawn-to-exit reachable."
  ],
  "decisions": [
    "Use unique external kits per level.",
    "Avoid full-level monolithic GLBs.",
    "Define level-relative anchors for powerups and encounters.",
    "Keep the foundation level minimum passage gate at 3 tiles.",
    "Reject one-tile corner pinches even when long straight runs still pass."
  ],
  "caughtIssues": [
    "The previous lane QA could pass a diagonal wall-corner squeeze that still looked like a one-unit path.",
    "The straight-run validator could pass L-shaped edge notches because their horizontal and vertical runs were both long."
  ],
  "risks": [
    "Weak scale references can make buildings, cover, and enemies feel wrong on mobile.",
    "Future prop placement can reintroduce narrow diagonal cuts if it bypasses validate-levels."
  ],
  "blockers": [],
  "artifacts": [
    "src/game/foundationLevelMap.json",
    "scripts/validate-levels.mjs",
    "src/tests/fpsFoundation.test.ts"
  ],
  "jsonForAgents": {
    "foundationPassageRules": {
      "minimumOpenTiles": 3,
      "rejectBoundedSegmentsBelowMinimum": true,
      "rejectDiagonalCornerCuts": true,
      "rejectCornerPinches": true,
      "knownFixedPinchWorldCoordinates": [
        [12.1, 1.6, -2.1],
        [12.2, 1.6, 7.6]
      ],
      "walkableTiles": 1640
    },
    "requiredLevelKitSections": [
      "environmentIdentity",
      "buildings",
      "coverProps",
      "hazards",
      "landmarks",
      "skyLighting",
      "rewardSpace",
      "powerupAnchors"
    ],
    "monolithicLevelGlbAllowed": false
  },
  "nextAgents": [
    "external-asset-scout",
    "enemy-asset-curator",
    "weapon-upgrade-asset-curator",
    "asset-playground-qa-agent"
  ]
}
