{
  "handoffVersion": "1.0.0",
  "agentId": "weapon-upgrade-asset-curator",
  "status": "in-progress",
  "updatedAt": "2026-07-04T04:45:00Z",
  "summary": "Three-gun slice now has forward-facing viewmodels, per-weapon ranges, and wall collision feedback.",
  "observations": [
    "SPARK is a fast sidearm using blaster-a.glb.",
    "BORE is a close scatter weapon using blaster-h.glb.",
    "VAULT is a heavy pulse weapon using blaster-p.glb.",
    "Each weapon has a procedural Web Audio firing profile until ElevenLabs audio is added.",
    "All three viewmodels use a forward-facing Y rotation near Math.PI.",
    "Shots raycast against the tile level and report lastShot wall hit details through debug state."
  ],
  "decisions": [
    "Expose the three weapons through a clickable landscape selector.",
    "Use one fire button for this slice.",
    "Leave upgrades, reload button, enemy/projectile behavior, and final hit impact assets for later iterations.",
    "Use primitive tracer and wall impact only as temporary gameplay feedback."
  ],
  "caughtIssues": [
    "Current assets are prop-scale GLB models, not dedicated animated first-person weapon rigs.",
    "Wall hit feedback currently uses code primitives rather than external assets."
  ],
  "risks": [
    "Model offsets may need per-device adjustment once gameplay camera tuning starts."
  ],
  "blockers": [],
  "artifacts": [
    "src/game/weapons/weaponManifest.ts",
    "src/game/weapons/weaponSystem.ts",
    "src/game/weapons/weaponAudio.ts",
    "public/assets/weapons/kenney-blaster-kit/models/blaster-a.glb",
    "public/assets/weapons/kenney-blaster-kit/models/blaster-h.glb",
    "public/assets/weapons/kenney-blaster-kit/models/blaster-p.glb"
  ],
  "jsonForAgents": {
    "weaponRoster": [
      {
        "assetId": "weapon.blaster.spark",
        "label": "SPARK",
        "role": "fast sidearm",
        "magazineSize": 18,
        "fireIntervalMs": 155,
        "rangeUnits": 28,
        "soundProfile": "sidearm"
      },
      {
        "assetId": "weapon.blaster.bore",
        "label": "BORE",
        "role": "close scatter",
        "magazineSize": 8,
        "fireIntervalMs": 470,
        "rangeUnits": 18,
        "soundProfile": "scatter"
      },
      {
        "assetId": "weapon.blaster.vault",
        "label": "VAULT",
        "role": "heavy pulse",
        "magazineSize": 12,
        "fireIntervalMs": 285,
        "rangeUnits": 24,
        "soundProfile": "heavy"
      }
    ],
    "requiresCameraReview": true
  },
  "nextAgents": [
    "camera-cutscene-agent",
    "mobile-fps-game-feel-agent",
    "asset-playground-qa-agent"
  ]
}
